{
  "id": "evt_9102",
  "scope": "run:run_88",
  "project_id": "p_123",
  "run_id": "run_88",
  "sequence": 12,
  "type": "run.reattached",
  "schema_version": 1,
  "occurred_at": "2026-09-26T09:05:00Z",
  "identity": {"project_id": "p_123", "run_id": "run_88", "attempt_id": "att_1", "agent_revision_id": "ar_12", "actor": {"type": "system", "id": "recoverer"}},
  "payload": {"previous_status": "recovering", "process_verified": true}
}
